{
  "schemaVersion": 1,
  "id": "hunter_ending_upheaval",
  "worldIds": [
    "hunter"
  ],
  "title": "수정 가능한 시스템",
  "description": "등급과 보상을 정하는 규칙에 이의를 제기할 수 있게 됐다. 가장 작은 존재도 오류를 신고하고 답을 받을 자리가 생겼다.",
  "image": "images/endings/hunter_upheaval.svg",
  "priority": 80,
  "isDefault": false,
  "conditions": {
    "all": [
      {
        "type": "flag",
        "key": "hunter_reform",
        "operator": "equals",
        "value": true
      },
      {
        "type": "stat",
        "key": "freedom",
        "operator": "gte",
        "value": 60
      },
      {
        "type": "stat",
        "key": "influence",
        "operator": "gte",
        "value": 45
      }
    ]
  }
}
