{
  "schemaVersion": 1,
  "id": "zombie_ending_upheaval",
  "worldIds": [
    "zombie"
  ],
  "title": "봉쇄 이후의 도시",
  "description": "문을 여는 규칙이 바뀌었다. 서로 다른 존재들이 같은 삶을 요구하지 않고도 함께 지낼 방법을 시험하기 시작했다.",
  "image": "images/endings/zombie_upheaval.svg",
  "priority": 80,
  "isDefault": false,
  "conditions": {
    "all": [
      {
        "type": "flag",
        "key": "zombie_reform",
        "operator": "equals",
        "value": true
      },
      {
        "type": "stat",
        "key": "freedom",
        "operator": "gte",
        "value": 60
      },
      {
        "type": "stat",
        "key": "influence",
        "operator": "gte",
        "value": 45
      }
    ]
  }
}
