{
  "schemaVersion": 1,
  "id": "space_ending_legend",
  "worldIds": [
    "space"
  ],
  "title": "항로가 된 이름",
  "description": "약속한 곳으로 신호를 보낸 덕분에 뒤따르는 이들이 길을 찾았다. 지도에는 별보다 먼저 당신의 이름이 적혔다.",
  "image": "images/endings/space_legend.svg",
  "priority": 60,
  "isDefault": false,
  "conditions": {
    "all": [
      {
        "type": "flag",
        "key": "space_promise",
        "operator": "equals",
        "value": true
      },
      {
        "type": "stat",
        "key": "influence",
        "operator": "gte",
        "value": 65
      }
    ]
  }
}
